{
  "result_id": "TRANSFER-RESULT-20260522T234916Z-8EE04130",
  "request_id": "CHECK-CONTOUR-STATUS",
  "action_type": "CHECK_CONTOUR_STATUS",
  "status": "UNKNOWN",
  "started_utc": "2026-05-22T23:49:16Z",
  "finished_utc": "2026-05-22T23:49:16Z",
  "evidence_refs": [
    "IMPERIUM_NEW_GENERATION/SANCTUM_NG/TRANSFER_CONSOLE/DATA/contours/contour_status.latest.json",
    "IMPERIUM_NEW_GENERATION/SANCTUM_NG/TRANSFER_CONSOLE/DATA/contours/probes/PROBE-20260522T234916Z-D4A6F3B0.json",
    "IMPERIUM_NEW_GENERATION/SANCTUM_NG/TRANSFER_CONSOLE/DATA/contours/probes/PROBE-20260522T234916Z-E352C2C7.json"
  ],
  "error": null,
  "not_proven": [
    "Contour status reflects bounded probes only; no production orchestration claim."
  ],
  "claim_boundary": "FOUNDATION_ONLY"
}
